{"edges":{"xe_501afa5d0be1df08cb6d7eb2":"branch_to_http","xe_510074657b6e209636cea898":"prepare_to_branch","xe_54fddcee1c746abcb1027fb0":"rpc_to_finalize","xe_bfd2c52ff8003b5ac47b96fc":"branch_to_rpc","xe_d09f4f20c6d873b86ab4098d":"start_to_prepare","xe_d78396ceca91f333a1a827a3":"finalize_to_end","xe_e7786901abd66aec0353c640":"http_to_finalize"},"fields":{"xn_28ab1668f6c71acdd9d628e0":{"operation.config.source_code":"inputs.source_code","outputs.result":"outputs.result"},"xn_2d5dd88597f16d2191c1187d":{"inputs.workflow_output":"inputs.workflow_output"},"xn_6c706ae5e194a43dd36e4333":{"outputs.workflow_input":"outputs.workflow_input"},"xn_9437d7ed93412b1e96426edf":{"inputs.request":"inputs.request","operation.config.contract_revision":"inputs.operation","operation.config.idempotent":"inputs.operation","operation.config.operation":"inputs.operation","operation.config.service_id":"inputs.service_ref","outputs.response":"outputs.response"},"xn_c3f8fedb1b8f6e85af20008f":{"inputs.body":"inputs.body","inputs.relative_path":"inputs.relative_path","operation.config.accepted_statuses":"inputs.accepted_statuses","operation.config.connection_id":"inputs.connection_ref","operation.config.method":"inputs.method","outputs.response":"outputs.response"},"xn_d1d1f62c10f03d3e24da4112":{"inputs.value":"inputs.value","operation.config.cases":"inputs.cases","operation.config.cases.0.operator":"inputs.cases.http_route.operator","operation.config.cases.0.route":"inputs.cases.http_route.route","operation.config.cases.0.value":"inputs.cases.http_route.value","operation.config.default_route":"inputs.default_route"},"xn_effb58806a10aa870dfb9441":{"inputs.request":"inputs.request","operation.config.source_code":"inputs.source_code","outputs.payload":"outputs.payload","outputs.score":"outputs.score"}},"nodes":{"xn_28ab1668f6c71acdd9d628e0":"finalize","xn_2d5dd88597f16d2191c1187d":"end","xn_6c706ae5e194a43dd36e4333":"start","xn_9437d7ed93412b1e96426edf":"create_via_rpc","xn_c3f8fedb1b8f6e85af20008f":"create_via_http","xn_d1d1f62c10f03d3e24da4112":"choose_transport","xn_effb58806a10aa870dfb9441":"prepare_order"},"source_map_version":"1"}
